{
  "entry_id": "0307",
  "national_id": 307,
  "form": "default",
  "names": {
    "en": "Meditite",
    "ja": "アサナン",
    "zh": "玛沙那"
  },
  "generation": 3,
  "types": [
    "fighting",
    "psychic"
  ],
  "types_zh": [
    "格斗",
    "超能力"
  ],
  "category": "めいそうポケモン",
  "category_zh": "冥想宝可梦",
  "abilities": [
    {
      "name_en": "pure-power",
      "name_zh": "瑜伽之力",
      "hidden": false
    },
    {
      "name_en": "telepathy",
      "name_zh": "心灵感应",
      "hidden": true
    }
  ],
  "height_m": 0.6,
  "weight_kg": 11.2,
  "gender_ratio": {
    "male_percent": 50.0,
    "female_percent": 50.0,
    "genderless": false
  },
  "capture_rate": 180,
  "color": "blue",
  "color_zh": "蓝色",
  "base_experience": 56,
  "growth_rate": "medium",
  "egg_groups": [
    "humanshape"
  ],
  "egg_groups_zh": [
    "人型"
  ],
  "base_stats": {
    "hp": 30,
    "attack": 40,
    "defense": 55,
    "special_attack": 40,
    "special_defense": 55,
    "speed": 60,
    "total": 280
  },
  "ev_yield": {
    "speed": 1
  },
  "evolution": {
    "from": [],
    "to": [
      {
        "national_id": 308,
        "name_en": "medicham",
        "name_zh": "恰雷姆",
        "trigger": "level-up"
      }
    ]
  },
  "regional_dex": {
    "丰缘": 76,
    "神奥": 86,
    "帕底亚": 161,
    "密阿雷": 83
  },
  "flavor_text_zh": "玛沙那的身躯以天蓝色为主，同时手臂上有乳白色的环状花纹，腹部亦为乳白色，它的脚也是白色的。它的头部形状类似于包子，两侧有圆形卷状物凸起，颜色为白色。它的眼睛相对较大，瞳孔为黑色。在脸部有叶状粉色的花纹。它的嘴位于眼睛正下方正对着竖线环纹处。雄性玛沙那的耳朵比雌性的更高。 玛沙那会在深山里进行瑜伽的修行。对它来说每天的瑜伽修行是不可或缺的，会通过冥想来提高精神力。它每天都要持续冥想好几个钟头，通过冥想提高精神力量后，就能让自己浮在空中。但冥想时注意力总会被打断，所以修行一直无法结束。它1天只吃1个树果，少吃也是修行的一个环节，会通过忍饥挨饿来磨砺己心。",
  "flavor_text_en": "Meditite heightens its inner energy through meditation. It survives on just one berry a day. Minimal eating is another aspect of this Pokémon’s training.",
  "is_default_form": true,
  "source": {
    "pokeapi_id": 307,
    "pokeapi_species_id": 307,
    "pokeapi_url": "https://pokeapi.co/api/v2/pokemon/307"
  }
}
