{
  "entry_id": "0975",
  "national_id": 975,
  "form": "default",
  "names": {
    "en": "Cetitan",
    "ja": "ハルクジラ",
    "zh": "浩大鲸"
  },
  "generation": 9,
  "types": [
    "ice"
  ],
  "types_zh": [
    "冰"
  ],
  "category": "りくくじらポケモン",
  "category_zh": "陆鲸宝可梦",
  "abilities": [
    {
      "name_en": "thick-fat",
      "name_zh": "厚脂肪 / 或 / 拨雪",
      "hidden": false
    },
    {
      "name_en": "slush-rush",
      "name_zh": "",
      "hidden": false
    },
    {
      "name_en": "sheer-force",
      "name_zh": "强行",
      "hidden": true
    }
  ],
  "height_m": 4.5,
  "weight_kg": 700.0,
  "gender_ratio": {
    "male_percent": 50.0,
    "female_percent": 50.0,
    "genderless": false
  },
  "capture_rate": 50,
  "color": "white",
  "color_zh": "白色",
  "base_experience": 182,
  "growth_rate": "medium-slow",
  "egg_groups": [
    "ground"
  ],
  "egg_groups_zh": [
    "陆上"
  ],
  "base_stats": {
    "hp": 170,
    "attack": 113,
    "defense": 65,
    "special_attack": 45,
    "special_defense": 55,
    "speed": 73,
    "total": 521
  },
  "ev_yield": {
    "hp": 2
  },
  "evolution": {
    "from": [
      {
        "national_id": 974,
        "name_en": "cetoddle",
        "name_zh": "走鲸",
        "trigger": ""
      }
    ],
    "to": []
  },
  "regional_dex": {
    "帕底亚": 362
  },
  "flavor_text_zh": "浩大鲸拥有支撑巨大身躯所需的强韧肌肉，拥有5根坚硬的角。 浩大鲸以庞大身躯进行的物理攻击拥有极高的威力。会在厚实的皮下脂肪的保护下，于冰雪地带回游走。它上颚的角能集中冰之能量而变得超低温，以此来将自己的周围冻结。 [ 2 ]",
  "flavor_text_en": "Ice energy builds up in the horn on its upper jaw, causing the horn to reach cryogenic temperatures that freeze its surroundings.",
  "is_default_form": true,
  "source": {
    "pokeapi_id": 975,
    "pokeapi_species_id": 975,
    "pokeapi_url": "https://pokeapi.co/api/v2/pokemon/975"
  }
}
