{
  "entry_id": "0854",
  "national_id": 854,
  "form": "default",
  "names": {
    "en": "Sinistea",
    "ja": "ヤバチャ",
    "zh": "来悲茶"
  },
  "generation": 8,
  "types": [
    "ghost"
  ],
  "types_zh": [
    "幽灵"
  ],
  "category": "こうちゃポケモン",
  "category_zh": "红茶宝可梦",
  "abilities": [
    {
      "name_en": "weak-armor",
      "name_zh": "碎裂铠甲",
      "hidden": false
    },
    {
      "name_en": "cursed-body",
      "name_zh": "咒术之躯",
      "hidden": true
    }
  ],
  "height_m": 0.1,
  "weight_kg": 0.2,
  "gender_ratio": {
    "genderless": true
  },
  "capture_rate": 120,
  "color": "purple",
  "color_zh": "紫色",
  "base_experience": 62,
  "growth_rate": "medium",
  "egg_groups": [
    "mineral",
    "indeterminate"
  ],
  "egg_groups_zh": [
    "矿物",
    "不定形"
  ],
  "base_stats": {
    "hp": 40,
    "attack": 45,
    "defense": 45,
    "special_attack": 74,
    "special_defense": 54,
    "speed": 50,
    "total": 308
  },
  "ev_yield": {
    "special_attack": 1
  },
  "evolution": {
    "from": [],
    "to": [
      {
        "national_id": 855,
        "name_en": "polteageist",
        "name_zh": "怖思壶",
        "trigger": "use-item"
      }
    ]
  },
  "regional_dex": {
    "伽勒尔": 335,
    "帕底亚": 237,
    "蓝莓": 127
  },
  "flavor_text_zh": "主页面： 形态变化 → 来悲茶和怖思壶 来悲茶的外表看起来就像是破损了的茶杯，茶杯上的图案看起来就像是来悲茶的眼睛以及嘴巴。但实际上来悲茶的本体是茶杯里的液体状身体，看起来像把手的东西也是身体伪装出来的。 被来悲茶当成住处的茶杯是有名的古董餐具，市面上有很多赝品。相比赝品形态，通过 极巨化 可以发现真品形态的底部有底款。有些爱好者会准备好极为讲究的茶杯和红茶，然后一直等待来悲茶来附身。据说它是因为害怕寂寞的死于孤独的死者之魂住进了凉透的喝剩红茶而诞生的，会在旅馆或民宅出现。它的弱点是身上的漩涡，如果把漩涡搅乱了，它就会头晕目眩。 斯魔茶 所拥有的漩涡和被认为是来悲茶弱点的漩涡很像，但不同的一点是这个漩涡似乎并非斯魔茶的弱点。来悲茶会吸走饮用者的精气，趁着自己被喝掉时进入对方身体里，从内部夺走对方的生物能量。虽然它十分贵重，会等待着别人来喝自己，但大家都会因为它太难喝而马上把它吐出来。",
  "flavor_text_en": "The teacup in which this Pokémon makes its home is a famous piece of antique tableware. Many forgeries are in circulation.",
  "is_default_form": true,
  "source": {
    "pokeapi_id": 854,
    "pokeapi_species_id": 854,
    "pokeapi_url": "https://pokeapi.co/api/v2/pokemon/854"
  }
}
