{
  "entry_id": "0439",
  "national_id": 439,
  "form": "default",
  "names": {
    "en": "Mime Jr.",
    "ja": "マネネ",
    "zh": "魔尼尼"
  },
  "generation": 4,
  "types": [
    "psychic",
    "fairy"
  ],
  "types_zh": [
    "超能力",
    "妖精"
  ],
  "category": "マイムポケモン",
  "category_zh": "默剧宝可梦",
  "abilities": [
    {
      "name_en": "soundproof",
      "name_zh": "隔音 / 或 / 过滤",
      "hidden": false
    },
    {
      "name_en": "filter",
      "name_zh": "",
      "hidden": false
    },
    {
      "name_en": "technician",
      "name_zh": "技术高手",
      "hidden": true
    }
  ],
  "height_m": 0.6,
  "weight_kg": 13.0,
  "gender_ratio": {
    "male_percent": 50.0,
    "female_percent": 50.0,
    "genderless": false
  },
  "capture_rate": 145,
  "color": "pink",
  "color_zh": "粉红色",
  "base_experience": 62,
  "growth_rate": "medium",
  "egg_groups": [
    "no-eggs"
  ],
  "egg_groups_zh": [
    "未发现"
  ],
  "base_stats": {
    "hp": 20,
    "attack": 25,
    "defense": 45,
    "special_attack": 70,
    "special_defense": 90,
    "speed": 60,
    "total": 310
  },
  "ev_yield": {
    "special_defense": 1
  },
  "evolution": {
    "from": [],
    "to": [
      {
        "national_id": 122,
        "name_en": "mr-mime",
        "name_zh": "魔墙人偶",
        "trigger": "level-up"
      }
    ]
  },
  "regional_dex": {
    "神奥": 94,
    "伽勒尔": 364,
    "洗翠": 76
  },
  "flavor_text_zh": "魔尼尼是一只粉红色的宝可梦，脚则是深蓝色的。它的肚子上有红色的凸起，脸上有一个红色的小丑鼻子。它有纤细的手臂和小手，头顶像是戴着一个蓝色的小丑帽。 魔尼尼喜欢人群聚集的地方，有着模仿对手动作的习性。它能模仿它所看到的对手的表情和动作，并试图理解对方的一切感情。如果对方因此大吃一惊，它就会很开心，甚至不知不觉忘记了自己正在模仿这件事。据说被模仿的对手会目不转睛，然后他就会趁对手迷惑的时候迅速逃走。有时它会忽然出现在热闹的市场中，像幼童般模仿人类的行为，然后兴致勃勃地观察人们的反应。它也会像徒弟一样跟随着擅长跳舞的 踏冰人偶 ，一心一意地拼命模仿踏冰人偶的舞步。",
  "flavor_text_en": "Known to turn up in bustling marketplaces now and again. It mimics people much as a child would, then watches how they react, eyes sparkling.",
  "is_default_form": true,
  "source": {
    "pokeapi_id": 439,
    "pokeapi_species_id": 439,
    "pokeapi_url": "https://pokeapi.co/api/v2/pokemon/439"
  }
}
