{
  "entry_id": "1024",
  "national_id": 1024,
  "form": "default",
  "names": {
    "en": "Terapagos",
    "ja": "テラパゴス",
    "zh": "太乐巴戈斯"
  },
  "generation": 9,
  "types": [
    "normal"
  ],
  "types_zh": [
    "一般"
  ],
  "category": "テラスタルポケモン",
  "category_zh": "太晶宝可梦",
  "abilities": [
    {
      "name_en": "tera-shift",
      "name_zh": "太晶变形",
      "hidden": false
    }
  ],
  "height_m": 0.2,
  "weight_kg": 6.5,
  "gender_ratio": {
    "male_percent": 50.0,
    "female_percent": 50.0,
    "genderless": false
  },
  "capture_rate": 255,
  "color": "blue",
  "color_zh": "蓝色",
  "base_experience": 90,
  "growth_rate": "slow",
  "egg_groups": [
    "no-eggs"
  ],
  "egg_groups_zh": [
    "未发现"
  ],
  "base_stats": {
    "hp": 90,
    "attack": 65,
    "defense": 85,
    "special_attack": 65,
    "special_defense": 85,
    "speed": 60,
    "total": 450
  },
  "ev_yield": {
    "defense": 1
  },
  "evolution": {},
  "regional_dex": {
    "蓝莓": 240
  },
  "flavor_text_zh": "《朱之书》/《紫之书》插图中的太乐巴戈斯 太乐巴戈斯形似陆龟，通体深蓝色，具有闪亮的浅蓝色大眼睛和玫瑰红色眼线。普通形态的太乐巴戈斯四肢较长，龟壳和身体部分是青蓝色的六角形晶体，背上刻着象征 太晶化 的图案。其脖颈与四肢都套着青蓝色环状物体，并镶嵌着青蓝色的四角星形晶体，尾巴末梢也呈四角星形。头部四周有青蓝色晶体装饰，头上的三枚相连的青紫色渐变的菱形晶体组合成类似于头发的模样。太晶形态的太乐巴戈斯身体大幅结晶化，四肢缩短得只能看见前爪，形状变得和圆盘一般。其龟壳上有十八块深蓝色五边形晶体环绕着中央的六角形太晶，而每块五边形晶体上都刻着象征《 朱／紫 》不同属性图标的花纹。其晶体与光泽比普通形态下更加闪亮，脖颈与尾巴部分也生出了闪光的蓝色长鬃毛。 太乐巴戈斯曾栖息在古代帕底亚地区，人们过去认为它在大约200万年前因地壳变动而招致灭绝。但它似乎把体内能量变为坚硬的结晶，并在休眠状态下保护了自身，是堪称太晶之源的宝可梦。太乐巴戈斯拥有一种太晶的能力，一旦察觉到危险，能够将体内制出的能量于体外结晶化。通过这个能力制出的结晶能形成坚硬的甲壳，而太乐巴戈斯将这种结晶罩在身上的样子便是“太晶形态”。若太晶的甲壳受到对手招式的攻击，就会将其能量吸收，供自己使用。“ 星晶 形态”似乎是在“太晶形态”下接触“ 太晶珠 ”时能看到的样子，是太乐巴戈斯太晶能量异常增强后的样子。此时的太晶能量被认为会异常增强。还有传闻称这与刊登在《朱之书》或《紫之书》上的“ ■盘的宝■梦 ？”相似。 [ 1 ] 星晶形态与古代人所认为的世界很像。跟据古老的探险记记载，它被掩埋在地底的样子就像浮在宇宙的星星一样。 根据白蕾雅的说法，太乐巴戈斯由太晶能量构成。其命名者海哲首次发现该物种。借助结晶的力量，它能发射无数星形能量弹攻击敌人。直接接触了太乐巴戈斯的能量后，就算不给太晶珠充能也可以进行太晶化。 太乐巴戈斯似乎有着穿越时空的能力。《 朱／紫 零之秘宝 》中，主角带着太乐巴戈斯来到 晶光池 时，太乐巴戈斯会发动自己的能力，让 奥琳博士 S / 弗图博士 V 穿越时空，出现在主角面前。",
  "flavor_text_en": "It’s thought that this Pokémon lived in ancient Paldea until it got caught in seismic shifts and went extinct.",
  "is_default_form": true,
  "source": {
    "pokeapi_id": 1024,
    "pokeapi_species_id": 1024,
    "pokeapi_url": "https://pokeapi.co/api/v2/pokemon/1024"
  }
}
