{
  "entry_id": "0373",
  "national_id": 373,
  "form": "default",
  "names": {
    "en": "Salamence",
    "ja": "ボーマンダ",
    "zh": "暴飞龙"
  },
  "generation": 3,
  "types": [
    "dragon",
    "flying"
  ],
  "types_zh": [
    "龙",
    "飞行"
  ],
  "category": "ドラゴンポケモン",
  "category_zh": "龙宝可梦",
  "abilities": [
    {
      "name_en": "intimidate",
      "name_zh": "威吓",
      "hidden": false
    },
    {
      "name_en": "moxie",
      "name_zh": "自信过度",
      "hidden": true
    }
  ],
  "height_m": 1.5,
  "weight_kg": 102.6,
  "gender_ratio": {
    "male_percent": 50.0,
    "female_percent": 50.0,
    "genderless": false
  },
  "capture_rate": 45,
  "color": "blue",
  "color_zh": "蓝色",
  "base_experience": 270,
  "growth_rate": "slow",
  "egg_groups": [
    "dragon"
  ],
  "egg_groups_zh": [
    "龙"
  ],
  "base_stats": {
    "hp": 95,
    "attack": 135,
    "defense": 80,
    "special_attack": 110,
    "special_defense": 80,
    "speed": 100,
    "total": 600
  },
  "ev_yield": {
    "attack": 3
  },
  "evolution": {
    "from": [
      {
        "national_id": 372,
        "name_en": "shelgon",
        "name_zh": "甲壳龙",
        "trigger": ""
      }
    ],
    "to": []
  },
  "regional_dex": {
    "丰缘": 189,
    "阿罗拉": 119,
    "帕底亚": 278,
    "密阿雷": 222
  },
  "flavor_text_zh": "暴飞龙是一种四足行走的龙宝可梦，拥有两根华丽的血红色翅膀，长着一根长长的尾巴。它全身底色深蓝，头颈、四肢和尾巴的内侧均为血红色，下颚和腹部被三片外壳所覆盖。它的双眼上方有两道血红色凸起，头部两侧各有三片小型三角翼。超级暴飞龙的两根翅膀因强大的能量而扭曲着粘在一起，形成一张巨大的新月形翅膀。它的头、颈、躯干都变得纤细，四肢变短，尾巴也变得细长。它头部两侧最上面的一对三角翼大幅增长，中间一对向前延伸至鼻翼，最下面一对无变化。它下颚的灰色外壳脱落，露出了光滑的红色皮肤，后腿根部有着红色半环。它的前肢收在月牙形羽翼下的两个“带子”里。 听说暴飞龙因为一直都强烈渴望地祈求着拥有翅膀飞上天空，结果导致体内的细胞发生了突变，长出了梦寐以求的华丽翅膀。为了表达喜悦的心情，它用最后终于长出来的翅膀在浩瀚的天空翱翔，不到精疲力竭要睡觉就几乎不落地。它喷着火焰，开心不已，将大地变成一片燃烧的原野。虽然在空中翱翔能够让它乐在其中，但是一旦被惹怒生气就会忘记自我，大闹一番，把周围都破坏得不可收拾。它会一边在空中飞行，一边用火把地面上的山野燃烧殆尽，用爪子将所有东西都撕裂。破坏会持续不断，直到暴飞龙精疲力尽。有时它会围绕着食物的问题和 烈咬陆鲨 展开空中战。 超级暴飞龙变得更为粗暴，连培育它的训练家也会袭击。别名是“染血的新月”。它会将前脚收拢在外壳的间隙中，变为飞行的姿势，即使是复杂的地形也能以高速飞来飞去。它那引以为傲的两根翅膀因强大的能量而扭曲着粘在一起，让它倍感压力，到处横冲直撞。它会用刀刃般锋利的翅膀一边将挡路的全都一切两半，一边不断飞行。",
  "flavor_text_en": "While basking in the joy of flight generally keeps this Pokémon in high spirits, Salamence turns into an uncontrollable menace if something angers it.",
  "is_default_form": true,
  "source": {
    "pokeapi_id": 373,
    "pokeapi_species_id": 373,
    "pokeapi_url": "https://pokeapi.co/api/v2/pokemon/373"
  }
}
