{
  "entry_id": "0175",
  "national_id": 175,
  "form": "default",
  "names": {
    "en": "Togepi",
    "ja": "トゲピー",
    "zh": "波克比"
  },
  "generation": 2,
  "types": [
    "fairy"
  ],
  "types_zh": [
    "妖精"
  ],
  "category": "はりたまポケモン",
  "category_zh": "针球宝可梦",
  "abilities": [
    {
      "name_en": "hustle",
      "name_zh": "活力 / 或 / 天恩",
      "hidden": false
    },
    {
      "name_en": "serene-grace",
      "name_zh": "",
      "hidden": false
    },
    {
      "name_en": "super-luck",
      "name_zh": "超幸运",
      "hidden": true
    }
  ],
  "height_m": 0.3,
  "weight_kg": 1.5,
  "gender_ratio": {
    "male_percent": 87.5,
    "female_percent": 12.5,
    "genderless": false
  },
  "capture_rate": 190,
  "color": "white",
  "color_zh": "白色",
  "base_experience": 49,
  "growth_rate": "fast",
  "egg_groups": [
    "no-eggs"
  ],
  "egg_groups_zh": [
    "未发现"
  ],
  "base_stats": {
    "hp": 35,
    "attack": 20,
    "defense": 65,
    "special_attack": 40,
    "special_defense": 65,
    "speed": 20,
    "total": 245
  },
  "ev_yield": {
    "special_defense": 1
  },
  "evolution": {
    "from": [],
    "to": [
      {
        "national_id": 176,
        "name_en": "togetic",
        "name_zh": "波克基古",
        "trigger": "level-up"
      }
    ]
  },
  "regional_dex": {
    "城都": 46,
    "神奥": 173,
    "伽勒尔": 257,
    "洗翠": 127
  },
  "flavor_text_zh": "波克比外观好似一颗蛋，身体以亮黄色为主。它的眼睛是黑色的，头顶上长有五个刺状物，在睡觉时这些刺会合在一起。它的身体大部分被蛋壳包裹着，上面有一些红色和蓝色的三角环状花纹。它有短而粗的手和圆圆的脚，脚上有两个趾，脚底有半圆形的褐色护垫。 波克比常让在野外遇见它的人误会蛋会自己动，它纯真的笑容有疗愈人心的功效。它会把大家感受到的温情和喜悦都转化为幸福，据说在它的壳里装着满满的幸福。它是好运的象征，如果能温柔对待它，它就会把幸运分给对方。有传言说，若是能让睡着的波克比好好站起来的话，就能变得幸福。",
  "flavor_text_en": "This ovate creature is frequently mistaken for a moving egg when encountered out in the fields or in the mountains. Its guileless smile soothes the soul.",
  "is_default_form": true,
  "source": {
    "pokeapi_id": 175,
    "pokeapi_species_id": 175,
    "pokeapi_url": "https://pokeapi.co/api/v2/pokemon/175"
  }
}
