{
  "entry_id": "0078-galar",
  "national_id": 78,
  "form": "galar",
  "names": {
    "en": "Rapidash",
    "ja": "ギャロップ",
    "zh": "烈焰马（伽勒尔的样子）"
  },
  "generation": 1,
  "types": [
    "psychic",
    "fairy"
  ],
  "types_zh": [
    "超能力",
    "妖精"
  ],
  "category": "ひのうまポケモン",
  "category_zh": "火马宝可梦",
  "abilities": [
    {
      "name_en": "run-away",
      "name_zh": "逃跑",
      "hidden": false
    },
    {
      "name_en": "pastel-veil",
      "name_zh": "",
      "hidden": false
    },
    {
      "name_en": "anticipation",
      "name_zh": "危险预知",
      "hidden": true
    }
  ],
  "height_m": 1.7,
  "weight_kg": 80.0,
  "gender_ratio": {
    "male_percent": 50.0,
    "female_percent": 50.0,
    "genderless": false
  },
  "capture_rate": 60,
  "color": "yellow",
  "color_zh": "黄色",
  "base_experience": 175,
  "growth_rate": "medium",
  "egg_groups": [
    "ground"
  ],
  "egg_groups_zh": [
    "陆上"
  ],
  "base_stats": {
    "hp": 65,
    "attack": 100,
    "defense": 70,
    "special_attack": 80,
    "special_defense": 80,
    "speed": 105,
    "total": 500
  },
  "ev_yield": {
    "speed": 2
  },
  "evolution": {
    "from": [
      {
        "national_id": 77,
        "name_en": "ponyta",
        "name_zh": "小火马",
        "trigger": ""
      }
    ],
    "to": []
  },
  "regional_dex": {
    "关都": 78,
    "城都": 202,
    "神奥": 91,
    "伽勒尔": 334,
    "洗翠": 24
  },
  "flavor_text_zh": "烈焰马是马外形的宝可梦。它的身材比 小火马 高大了不少，通体淡黄色，从头顶沿着脊背至马尾长着熊熊燃烧的火焰鬃毛。它的头顶上生出了一根类似于独角的物体，眼睛呈火红色。伽勒尔烈焰马的头顶尾巴和四肢都长着粉紫色和淡蓝色的长鬃毛，身体白色，眼睛为淡蓝色，其身姿更接近于独角兽。 烈焰马总之就是喜欢跑步，虽然平时会很悠闲地在原野上到处乱跑，但如果看到快速移动的物体它就会想要前去较量一番并用猛烈的速度开始追赶。它加速力非常强劲，只跑出十步就可以达到最高时速240千米。它飞奔的时候四足几乎不着地，鬃毛上的火焰会剧烈燃烧、闪闪发光，能像箭一样地飞驰而去。速度涨上来之后，鬃毛会飘的更长，看起来更加漂亮。奔跑速度最快的烈焰马会成为首领，决定族群前往的地点和奔跑速度。神骏无比的它只需一天半的功夫就能横越整个 洗翠 大地。 伽勒尔烈焰马勇猛果敢，自尊心强。它会在蹄子上的毛里储存精神力量，在森林中轻快地奔跑。它会从犄角发射强力的精神利刃，那超群的破坏力甚至可以在厚厚的铁板上开出洞来。",
  "flavor_text_en": "Fiery mane aglow, Rapidash darts like an arrow across the land. This prodigiously swift creature can traverse the vast region of Hisui in a day and a half.",
  "is_default_form": false,
  "source": {
    "pokeapi_id": 10163,
    "pokeapi_species_id": 78,
    "pokeapi_url": "https://pokeapi.co/api/v2/pokemon/10163"
  }
}
